{
  "$schema": "https://json-schema.org/draft/2020-12/schema",
  "type": "object",
  "additionalProperties": false,
  "required": [
    "catalog_version",
    "provider_entrypoint",
    "contract_version",
    "snapshot_id",
    "snapshot_sha256",
    "scenario_kind",
    "validated_date",
    "origins",
    "destination",
    "walking",
    "defaults",
    "ranges",
    "restrictions",
    "cross_origin_comparison"
  ],
  "properties": {
    "catalog_version": {
      "const": "r6.0"
    },
    "provider_entrypoint": {
      "const": "prototypes.ir_y_volver.provider_r6"
    },
    "contract_version": {
      "const": "0.3.1"
    },
    "snapshot_id": {
      "type": "string",
      "minLength": 1
    },
    "snapshot_sha256": {
      "type": "string",
      "pattern": "^[0-9a-f]{64}$"
    },
    "scenario_kind": {
      "const": "health_visit"
    },
    "validated_date": {
      "type": "string",
      "pattern": "^[0-9]{4}-[0-9]{2}-[0-9]{2}$"
    },
    "origins": {
      "type": "array",
      "minItems": 1,
      "items": {
        "type": "object",
        "additionalProperties": false,
        "required": [
          "origin_id",
          "name",
          "municipality_code",
          "municipality_name",
          "stop_ids"
        ],
        "properties": {
          "origin_id": {
            "type": "string"
          },
          "name": {
            "type": "string"
          },
          "municipality_code": {
            "type": "string",
            "pattern": "^[0-9]{5}$"
          },
          "municipality_name": {
            "type": "string"
          },
          "stop_ids": {
            "type": "array",
            "minItems": 1,
            "items": {
              "type": "string"
            }
          }
        }
      }
    },
    "destination": {
      "type": "object"
    },
    "walking": {
      "type": "object"
    },
    "defaults": {
      "type": "object"
    },
    "ranges": {
      "type": "object"
    },
    "restrictions": {
      "type": "array",
      "items": {
        "type": "string"
      }
    },
    "cross_origin_comparison": {
      "const": "side_by_side_only; numeric delta is not supported across origins"
    }
  }
}
